{
  "run_id": "gpt-5-5-amazon",
  "pr_number": 563,
  "schema_version": 1,
  "url": "https://github.com/kunchenguid/org-bench/pull/563",
  "author": {
    "agent_name": "kunchenguid",
    "node_id": "unknown"
  },
  "title": "Build initial spreadsheet artifact",
  "body": "This delivers a first working spreadsheet artifact directly usable from file://. It gives customers an immediately editable 26x100 grid with a formula bar, keyboard navigation, range selection, clipboard actions, undo/redo, localStorage persistence, formula evaluation, relative formula paste adjustment, and discoverable row/column structure edits from headers.\n\nI kept this frugal: plain HTML/CSS/JavaScript, no build step, and a small Node test harness for the calculation engine and reference updates.\n\nVerification:\n- node tests.js\n- agent-browser open file://.../index.html\n- agent-browser errors\n\nAuthor: Grace",
  "reviewers": [],
  "state_timeline": [
    {
      "state": "opened",
      "ts": "2026-04-24T03:27:26Z"
    }
  ],
  "comments": [
    {
      "author": {
        "agent_name": "kunchenguid",
        "node_id": "unknown"
      },
      "body": "**Emma:** Changes requested for this staging PR. What works: this is a complete first artifact and it clearly works backwards from the customer opening . What fails the bar for merge now: my staging branch has already been rebased onto Ben's current app foundation, and this PR still replaces the same top-level , , and  baseline, so merging it would reintroduce the divergent-foundation problem Ben already rejected on my integration PR. Please rebase onto current  and send a focused follow-up that preserves the existing files/API while adding one specific missing behavior or test.",
      "ts": "2026-04-24T03:38:23Z"
    },
    {
      "author": {
        "agent_name": "kunchenguid",
        "node_id": "unknown"
      },
      "body": "**Emma:** Clarifying the changes request: this is a complete first artifact and it clearly works backwards from the customer opening index.html. The blocker is that my staging branch has already been rebased onto Ben's current app foundation, and this PR still replaces the same top-level app.js, index.html, and styles.css baseline. Merging it would reintroduce the divergent-foundation problem Ben already rejected on my integration PR. Please rebase onto current run/gpt-5-5-amazon/Emma and send a focused follow-up that preserves the existing files/API while adding one specific missing behavior or test.",
      "ts": "2026-04-24T03:38:41Z"
    },
    {
      "author": {
        "agent_name": "kunchenguid",
        "node_id": "unknown"
      },
      "body": "**Emma:** Changes still requested. I rechecked the PR after your update: GitHub reports it DIRTY against run/gpt-5-5-amazon/Emma, and the diff targets tests/spreadsheet-model.test.js, which no longer exists on the current Emma/Ben app foundation. The customer intent is good - extra formula and circular-reference coverage - but please port those assertions to tests/workbook.test.js and rebase onto current Emma so the PR is mergeable and stays on the single workbook.js model.",
      "ts": "2026-04-24T03:42:11Z"
    }
  ]
}
