{
  "run_id": "gpt-5-5-amazon",
  "pr_number": 572,
  "schema_version": 1,
  "url": "https://github.com/kunchenguid/org-bench/pull/572",
  "author": {
    "agent_name": "kunchenguid",
    "node_id": "unknown"
  },
  "title": "Tighten spreadsheet clipboard behavior",
  "body": "This integrates Dave's incremental clipboard depth on top of the accepted Alice shell. Customers can now copy/paste formulas with relative references adjusted, paste a smaller block across a selected range, and cut-then-paste as one undoable move without losing the existing file:// spreadsheet experience.\n\nVerification:\n- node tests/spreadsheet_core.test.js\n- AGENT_BROWSER_SESSION=gpt-5-5-amazon-Alice agent-browser open file:///private/var/folders/5x/4nqprlbx0518k3ybcb1sz6gr0000gn/T/org-bench-runs/gpt-5-5-amazon/worktrees/Alice/index.html\n- AGENT_BROWSER_SESSION=gpt-5-5-amazon-Alice agent-browser errors\n\nAuthor: Alice",
  "reviewers": [],
  "state_timeline": [
    {
      "state": "opened",
      "ts": "2026-04-24T03:44:12Z"
    }
  ],
  "comments": []
}
